{"$schema":"https://json-schema.org/draft/2020-12/schema","$id":"https://res.example/schemas/release-support.schema.json","type":"object","additionalProperties":false,"required":["schema_version","release_id","product","version","support_tier","assumptions","required_products","notes"],"properties":{"schema_version":{"const":"1.0.0"},"release_id":{"type":"string","pattern":"^IBMI-[0-9]+\\.[0-9]+$"},"product":{"const":"IBM i"},"version":{"type":"string","pattern":"^[0-9]+\\.[0-9]+$"},"support_tier":{"enum":["target","candidate","retired","investigation"]},"assumptions":{"type":"array","items":{"type":"string"}},"required_products":{"type":"array","items":{"type":"object","required":["name","optional"],"properties":{"name":{"type":"string"},"optional":{"type":"boolean"}},"additionalProperties":false}},"notes":{"type":"array","items":{"type":"string"}}}}
